{
  "task_id": "task_123",
  "objective": "Refactor auth module",
  "success_criteria": ["Auth tests pass", "Public API remains compatible"],
  "repo": "github.com/org/repo",
  "scope": {
    "org_id": "acme",
    "project_id": "platform"
  },
  "policy_id": "default_safe",
  "budget": {
    "soft_limit_usd": 2.5,
    "hard_limit_usd": 5.0
  },
  "llm_provider": {
    "provider_id": "openrouter",
    "model": "openai/gpt-4o-mini"
  },
  "toolsets": {
    "enabled": ["web", "file", "code_execution", "memory", "delegation", "connectors", "approvals"],
    "disabled": []
  },
  "provider_runtime": {
    "format": "divinity.provider_runtime.v1",
    "provider_id": "openrouter",
    "display_name": "OpenRouter",
    "transport": "chat_completions",
    "base_url": "https://openrouter.ai/api/v1",
    "model": "openai/gpt-4o-mini",
    "auth": {
      "mode": "api_key",
      "credential_required": true,
      "credential_configured": false,
      "credential_env_vars": ["OPENROUTER_API_KEY"],
      "configured_env_vars": []
    },
    "capabilities": ["chat", "tool_calls", "model_catalog", "aggregator", "free_tier_models"],
    "source": "hermes_runtime_provider_reference"
  },
  "toolset_resolution": {
    "format": "divinity.toolset_resolution.v1",
    "toolsets": [
      {
        "format": "divinity.toolset.v1",
        "toolset_id": "web",
        "description": "Research and content extraction tools for public web context.",
        "tools": ["web_extract", "web_search"],
        "default_enabled": true,
        "risk_level": "low",
        "policy_permissions": ["network:read"]
      }
    ],
    "tools": ["web_extract", "web_search"],
    "tool_schemas": [
      {
        "name": "web_extract",
        "description": "Extract readable public web page content from a URL and return source metadata for operator review.",
        "input_schema": {
          "type": "object",
          "properties": {
            "url": {
              "type": "string",
              "description": "Public URL to fetch and summarize."
            }
          },
          "required": ["url"],
          "additionalProperties": false
        },
        "toolsets": ["web"],
        "risk_level": "low",
        "policy_permissions": ["network:read"]
      },
      {
        "name": "web_search",
        "description": "Search public web results for a concise query and return source metadata for operator review.",
        "input_schema": {
          "type": "object",
          "properties": {
            "query": {
              "type": "string",
              "description": "Search query to run against public web results."
            }
          },
          "required": ["query"],
          "additionalProperties": false
        },
        "toolsets": ["web"],
        "risk_level": "low",
        "policy_permissions": ["network:read"]
      }
    ],
    "policy_permissions": ["network:read"],
    "risk_summary": {
      "highest_risk_level": "low",
      "high_risk_toolsets": [],
      "medium_risk_toolsets": [],
      "low_risk_toolsets": ["web"]
    },
    "provider_capability_checks": [
      {
        "provider_id": "openrouter",
        "capability": "tool_calls",
        "status": "supported",
        "required_by_toolsets": ["web"]
      }
    ],
    "operator_controls": []
  },
  "created_at": "2026-05-24T00:00:00Z"
}
